{
  "benchmark": {
    "id": "local_hlc_tick",
    "mean": {
      "confidence_level": 0.95,
      "lower": 32.94993062748984,
      "point": 34.140520863413,
      "upper": 35.363212508531795
    },
    "median": {
      "confidence_level": 0.95,
      "lower": 30.19752464765092,
      "point": 32.16470870864275,
      "upper": 36.15258019707994
    },
    "threshold_upper_ns": 100.0,
    "unit": "ns"
  },
  "command": "cargo bench -p alopex-chirps --features hlc --bench hlc_bench -- --noplot",
  "host": {
    "kernel": "6.18.35.2-microsoft-standard-WSL2",
    "machine": "x86_64",
    "rustc": "rustc 1.96.0 (ac68faa20 2026-05-25)"
  },
  "release_version": "0.6.0",
  "result": "pass",
  "schema": "chirps.hlc-benchmark/v1",
  "source_tree_sha256": "237484a509d88e0e12e4955929ca12b0a52c9fa5fe0396ab52fab93ab378d273"
}
